A1: QQ号码 | B1: 第一轮 | E1: 第二轮 | K1: 第三轮
B2: 票数 | C2: 名次 | D2: 成绩 | E2: 胜 | F2: 负 | G2: 平 | H2: 积分 | I2: 名次 | J2: 成绩 | K2: 总名次 | L2: 总成绩
A3: 370285156 | B3: 3144 | C3: 3 | D3: 98 | E3: 42 | F3: 8 | G3: 0 | H3: 126 | I3: 2 | J3: 99 | K3: 1 | L3: =D3*0.6+J3*0.4 -> 98.4
A4: 123486526 | B4: 3043 | C4: 4 | D4: 97 | E4: 38 | F4: 8 | G4: 4 | H4: 118 | I4: 4 | J4: 97 | K4: 2 | L4: =D4*0.6+J4*0.4 -> 97
A5: 491458172 | B5: 1519 | C5: 7 | D5: 94 | E5: 47 | F5: 3 | G5: 0 | H5: 141 | I5: 1 | J5: 100 | K5: 3 | L5: =D5*0.6+J5*0.4 -> 96.4
A6: 200848889 | B6: 1258 | C6: 9 | D6: 92 | E6: 37 | F6: 13 | G6: 0 | H6: 111 | I6: 5 | J6: 96 | K6: 4 | L6: =D6*0.6+J6*0.4 -> 93.6
A7: 492508556 | B7: 1408 | C7: 8 | D7: 93 | E7: 34 | F7: 15 | G7: 1 | H7: 103 | I7: 8(并列) | J7: 92.5 | K7: 5 | L7: =D7*0.6+J7*0.4 -> 92.8
A8: 157366053 | B8: 2520 | C8: 6 | D8: 95 | E8: 33 | F8: 16 | G8: 1 | H8: 100 | I8: 13 | J8: 88 | K8: 6 | L8: =D8*0.6+J8*0.4 -> 92.2
A9: 499807964 | B9: 565 | C9: 18 | D9: 83 | E9: 40 | F9: 7 | G9: 3 | H9: 123 | I9: 3 | J9: 98 | K9: 7 | L9: =D9*0.6+J9*0.4 -> 89
A10: 992329212 | B10: 3439 | C10: 1 | D10: 100 | E10: 20 | F10: 30 | G10: 0 | H10: 60 | I10: 20 | J10: 71 | K10: 8 | L10: =D10*0.6+J10*0.4 -> 88.4
A11: 274838 | B11: 357 | C11: 20 | D11: 81 | E11: 34 | F11: 15 | G11: 1 | H11: 103 | I11: 8(并列) | J11: 92.5 | K11: 9(并列) | L11: =D11*0.6+J11*0.4 -> 85.6
A12: 564259194 | B12: 813 | C12: 13 | D12: 88 | E12: 26 | F12: 22 | G12: 2 | H12: 80 | I12: 19 | J12: 82 | K12: 9(并列) | L12: =D12*0.6+J12*0.4 -> 85.6